<?xml version="1.0" encoding="UTF-8"?>
<digitalni_sertifikat 
    xmlns="http://www.akatsuki.org/digitalni_sertifikat"
    xmlns:xsi="http://www.w3.org/2001/XMLSchema-instance"
    xmlns:t="http://www.akatsuki.org/tipovi"
    xsi:schemaLocation="http://www.akatsuki.org digitalni_sertifikat.xsd
    http://www.akatsuki.org/tipovi tipovi.xsd"
    datum_i_vreme_izdavanja="2001-10-26T21:32:52" broj_sertifikata="2352">
    <primalac>
        <t:ime>Aleksandar</t:ime>
        <t:prezime>Buljevic</t:prezime>
        <t:jmbg>1510999800078</t:jmbg>
        <t:pol>Muski</t:pol>
        <t:broj_pasosa>792875436</t:broj_pasosa>
        <t:datum_rodjenja>1999-10-15</t:datum_rodjenja>
    </primalac>
    <vakcinacija>
        <doza broj="1">
            <tip nazivVakcine="Pfizer-BioNTech"></tip>
            <proizvodjac_i_serija>BIONTECH MANUFACTURING GMBH</proizvodjac_i_serija>
            <datum>2021-09-09</datum>
            <zdravstvena_ustanova>Promenada u Novom Sadu</zdravstvena_ustanova>
        </doza>
        <doza broj="2">
            <tip nazivVakcine="Pfizer-BioNTech"></tip>
            <proizvodjac_i_serija>BIONTECH MANUFACTURING GMBH</proizvodjac_i_serija>
            <datum>2021-09-09</datum>
            <zdravstvena_ustanova>Promenada u Novom Sadu</zdravstvena_ustanova>
        </doza>
    </vakcinacija>
    <testovi>
        <test>
            <vrsta_uzorka>N/A</vrsta_uzorka>
            <proizvodjac>f</proizvodjac>
            <datum_uzorkovanja>2001-10-26T21:32:52</datum_uzorkovanja>
            <datum_izdavanja_rezultata>2001-10-26T21:32:52</datum_izdavanja_rezultata>
            <rezultat>N/A</rezultat>
            <laboratorija>N/A</laboratorija>
        </test>
        <test>
            <vrsta_uzorka>N/A</vrsta_uzorka>
            <proizvodjac>N/A</proizvodjac>
            <datum_uzorkovanja>2001-10-26T21:32:52</datum_uzorkovanja>
            <datum_izdavanja_rezultata>2001-10-26T21:32:52</datum_izdavanja_rezultata>
            <rezultat>N/A</rezultat>
            <laboratorija>N/A</laboratorija>
        </test>
        <test>
            <vrsta_uzorka>N/A</vrsta_uzorka>
            <proizvodjac>N/A</proizvodjac>
            <datum_uzorkovanja>2001-10-26T21:32:52</datum_uzorkovanja>
            <datum_izdavanja_rezultata>2001-10-26T21:32:52</datum_izdavanja_rezultata>
            <rezultat>N/A</rezultat>
            <laboratorija>N/A</laboratorija>
        </test>
    </testovi>
</digitalni_sertifikat>
